{"algorithm":"typaxis.forced-page-break-trace/1","break_usage_sha256":"dfcaf020f4599bc01976c1a318f9dc05225135b75e098d52b5fb1b017e0e6a57","contract":"typaxis.contract/1.2","flow_registry_sha256":"3d32fdfbe55d147f613c52b266dfcad63b51d87fe46c19bb687e921145c77953","forced_page_breaks":[{"after_cursor":{"flow_id":0,"flow_local_ordinal":1},"before_cursor":{"flow_id":0,"flow_local_ordinal":0},"break_node_id":1,"document_ordinal":0,"produced_page_index":1},{"after_cursor":{"flow_id":0,"flow_local_ordinal":3},"before_cursor":{"flow_id":0,"flow_local_ordinal":2},"break_node_id":3,"document_ordinal":1,"produced_page_index":2},{"after_cursor":{"flow_id":0,"flow_local_ordinal":4},"before_cursor":{"flow_id":0,"flow_local_ordinal":3},"break_node_id":4,"document_ordinal":2,"produced_page_index":3},{"after_cursor":{"flow_id":0,"flow_local_ordinal":6},"before_cursor":{"flow_id":0,"flow_local_ordinal":5},"break_node_id":6,"document_ordinal":3,"produced_page_index":4}],"layout_epoch":{"admitted_resources_sha256":"55226c25adbdf5cfde192abdb15de07753e1081db59c1bfc5f6eb829f0d20952","document_sha256":"5343527aee6962f9e0b07150eab327bb67a336b6d6875765412591976d89067e","resolved_input_sha256":"6906122af2bf484a8a7306f84ec7e755ed70956ea563fa7c0a9b181c7f657b9f","style_page_master_sha256":"b972bb9dd2016ea6a31cfc7296f320d93a64058bfb37083157d0061b0dccbbcd"},"page_count":5,"pages":[{"is_blank":true,"page_index":0,"painted_content_count":0},{"is_blank":false,"page_index":1,"painted_content_count":1},{"is_blank":true,"page_index":2,"painted_content_count":0},{"is_blank":false,"page_index":3,"painted_content_count":1},{"is_blank":true,"page_index":4,"painted_content_count":0}],"policy_version":"typaxis.basic-forced-page-break-policy/1"}
